{
  "version": "1.1",
  "batch_id": "2025-08-12T06:00Z#obs",
  "corridor": "USDC-Baseâ†”USDC-Base",
  "participants": [
    { "entity_id": "blinded#A", "wallet_tag": "A1", "notional": 1250000, "fee_bps": 0.0 },
    { "entity_id": "blinded#B", "wallet_tag": "B3", "notional": 1250000, "fee_bps": 0.0 }
    ],
  "timestamps": {
    "observed_at": "2025-08-12T06:00:05Z",
    "finality_at": "2025-08-12T06:00:18Z",
    "receipt_emitted_at": "2025-08-12T06:00:23Z"
  },
  "receipt_emission_ms": 5000,
  "finality_ref": { "chain": "Base", "height": "12345678", "tx": "0xabc123..." },
  "policy_hooks": {
    "whitelist": true,
    "cap_check": true,
    "tr_message_id_ref": "TR-abc123",
    "sanctions_ref": "KYT-xyz789"
  },
  "fairness": {
    "queue_position": null,
    "vrf_seed_ref": null,
    "ordering_proof": null
  },
  "incident_code": null,
  "hash_anchor": null,
  "sig": "ed25519:BASE64_SIGNATURE",
  "pubkey_ref": "coordinator_v1_ed25519",
  "revocation_list_ref": "https://example.com/keys/rl.json"
}
